{
  "version": 1,
  "gate_db": 12,
  "min_dbm": 100,
  "ttl_s": 60,
  "alert_s": 30,
  "approach_db10s": 3,
  "slice_ms": 2000,
  "hopper_channels": 5,
  "hopper_hits": 6,
  "cadence_percent": 25,
  "wide_mhz": 10,
  "wide_hits": 4,
  "wifi_tolerance_us": 9000,
  "video_percent": 25,
  "fpv_mhz": [
    5865,
    5845,
    5825,
    5805,
    5785,
    5765,
    5745,
    5725,
    5733,
    5752,
    5771,
    5790,
    5809,
    5828,
    5847,
    5866,
    5705,
    5685,
    5665,
    5645,
    5885,
    5905,
    5925,
    5945,
    5740,
    5760,
    5780,
    5800,
    5820,
    5840,
    5860,
    5880,
    5658,
    5695,
    5732,
    5769,
    5806,
    5843,
    5880,
    5917
  ]
}
